<?xml version="1.0" encoding="UTF-8"?>
<studenci xmlns:xsi="http://www.w3.org/2001/XMLSchema-instance"
xsi:noNamespaceSchemaLocation="student.xsd">
    <student>
        <imie>Jan</imie>
        <nazwisko>Nowak</nazwisko>
        <rokStudiow>3</rokStudiow>
    </student>
    <student>
        <imie>Olga</imie>
        <nazwisko>Kot</nazwisko>
        <rokStudiow>2</rokStudiow>
    </student>
    <student>
        <imie>Leon</imie>
        <nazwisko>Knot</nazwisko>
        <rokStudiow>4</rokStudiow>
    </student>
    <rekruter>
        <imie>Anna</imie>
        <nazwisko>Kowal</nazwisko>
    </rekruter>
</studenci>
